<?xml version="1.0" encoding="UTF-8" ?>

<!ELEMENT sqlMap (typeAlias* | cacheModel* | resultMap* | parameterMap* | statement* | insert* | update* | delete* | select* | procedure*)+>
<!ATTLIST sqlMap
xmlns:fo CDATA #IMPLIED
namespace CDATA #IMPLIED
>

<!ELEMENT parameterMap (parameter+)>
<!ATTLIST parameterMap
id CDATA #REQUIRED
class CDATA #REQUIRED
>
<!ELEMENT parameter EMPTY>
<!ATTLIST parameter
property CDATA #REQUIRED
javaType CDATA #IMPLIED
jdbcType CDATA #IMPLIED
nullValue CDATA #IMPLIED
mode (IN | OUT | INOUT) #IMPLIED
>
<!ELEMENT resultMap (result+)>
<!ATTLIST resultMap
id CDATA #REQUIRED
class CDATA #REQUIRED
extends CDATA #IMPLIED
xmlName CDATA #IMPLIED
>
<!ELEMENT result EMPTY>
<!ATTLIST result
property CDATA #REQUIRED
javaType CDATA #IMPLIED
column CDATA #IMPLIED
columnIndex CDATA #IMPLIED
jdbcType CDATA #IMPLIED
nullValue CDATA #IMPLIED
select CDATA #IMPLIED
>
<!ELEMENT cacheModel (flushInterval?, flushOnExecute*, property*)+>
<!ATTLIST cacheModel
id CDATA #REQUIRED
type CDATA #REQUIRED
readOnly (true | false) #IMPLIED
serialize (true | false) #IMPLIED
>
<!ELEMENT flushInterval EMPTY>
<!ATTLIST flushInterval
milliseconds CDATA #IMPLIED
seconds CDATA #IMPLIED
minutes CDATA #IMPLIED
hours CDATA #IMPLIED
>
<!ELEMENT flushOnExecute EMPTY>
<!ATTLIST flushOnExecute
statement CDATA #REQUIRED
>

<!ELEMENT property EMPTY>
<!ATTLIST property
name CDATA #REQUIRED
value CDATA #REQUIRED
>

<!ELEMENT typeAlias EMPTY>
<!ATTLIST typeAlias
alias CDATA #REQUIRED
type CDATA #REQUIRED
>

<!ELEMENT statement (#PCDATA | dynamic | iterate | isParameterPresent | isNotParameterPresent | isEmpty | isNotEmpty | isNotNull | isNull | isNotEqual | isEqual | isGreaterThan | isGreaterEqual | isLessThan | isLessEqual | isPropertyAvailable | isNotPropertyAvailable)*>
<!ATTLIST statement
id CDATA #REQUIRED
parameterMap CDATA #IMPLIED
parameterClass CDATA #IMPLIED
resultMap CDATA #IMPLIED
resultClass CDATA #IMPLIED
cacheModel CDATA #IMPLIED
xmlResultName CDATA #IMPLIED
>

<!ELEMENT select (#PCDATA | dynamic | iterate | isParameterPresent | isNotParameterPresent | isEmpty | isNotEmpty | isNotNull | isNull | isNotEqual | isEqual | isGreaterThan | isGreaterEqual | isLessThan | isLessEqual | isPropertyAvailable | isNotPropertyAvailable)*>
<!ATTLIST select
id CDATA #REQUIRED
parameterMap CDATA #IMPLIED
parameterClass CDATA #IMPLIED
resultMap CDATA #IMPLIED
resultClass CDATA #IMPLIED
cacheModel CDATA #IMPLIED
xmlResultName CDATA #IMPLIED
>

<!ELEMENT insert (#PCDATA | selectKey | dynamic | iterate | isParameterPresent | isNotParameterPresent | isEmpty | isNotEmpty | isNotNull | isNull | isNotEqual | isEqual | isGreaterThan | isGreaterEqual | isLessThan | isLessEqual | isPropertyAvailable | isNotPropertyAvailable)*>
<!ATTLIST insert
id CDATA #REQUIRED
parameterMap CDATA #IMPLIED
parameterClass CDATA #IMPLIED
>

<!ELEMENT selectKey (#PCDATA) >
<!ATTLIST selectKey
resultClass CDATA #IMPLIED
keyProperty CDATA #IMPLIED
>

<!ELEMENT update (#PCDATA | dynamic | iterate | isParameterPresent | isNotParameterPresent | isEmpty | isNotEmpty | isNotNull | isNull | isNotEqual | isEqual | isGreaterThan | isGreaterEqual | isLessThan | isLessEqual | isPropertyAvailable | isNotPropertyAvailable)*>
<!ATTLIST update
id CDATA #REQUIRED
parameterMap CDATA #IMPLIED
parameterClass CDATA #IMPLIED
>

<!ELEMENT delete (#PCDATA | dynamic | iterate | isParameterPresent | isNotParameterPresent | isEmpty | isNotEmpty | isNotNull | isNull | isNotEqual | isEqual | isGreaterThan | isGreaterEqual | isLessThan | isLessEqual | isPropertyAvailable | isNotPropertyAvailable)*>
<!ATTLIST delete
id CDATA #REQUIRED
parameterMap CDATA #IMPLIED
parameterClass CDATA #IMPLIED
>

<!ELEMENT procedure (#PCDATA | dynamic | iterate | isParameterPresent | isNotParameterPresent | isEmpty | isNotEmpty | isNotNull | isNull | isNotEqual | isEqual | isGreaterThan | isGreaterEqual | isLessThan | isLessEqual | isPropertyAvailable | isNotPropertyAvailable)*>
<!ATTLIST procedure
id CDATA #REQUIRED
parameterMap CDATA #IMPLIED
parameterClass CDATA #IMPLIED
resultMap CDATA #IMPLIED
resultClass CDATA #IMPLIED
cacheModel CDATA #IMPLIED
xmlResultName CDATA #IMPLIED
>

<!-- - - - - - - - - - - - - - - - - - - - - - - - -
                 DYNAMIC ELEMENTS
  - - - - - - - - - - - - - - - - - - - - - - - - -->

<!ELEMENT dynamic (#PCDATA | iterate | isParameterPresent | isNotParameterPresent | isEmpty | isNotEmpty | isNotNull | isNull | isNotEqual | isEqual | isGreaterThan | isGreaterEqual | isLessThan | isLessEqual | isPropertyAvailable | isNotPropertyAvailable)*>
<!ATTLIST dynamic
prepend CDATA #IMPLIED
>

<!ELEMENT isNotNull (#PCDATA | iterate | isParameterPresent | isNotParameterPresent | isEmpty | isNotEmpty | isNotNull | isNull | isNotEqual | isEqual | isGreaterThan | isGreaterEqual | isLessThan | isLessEqual | isPropertyAvailable | isNotPropertyAvailable)*>
<!ATTLIST isNotNull
prepend CDATA #IMPLIED
property CDATA #IMPLIED
>

<!ELEMENT isNull (#PCDATA | iterate | isParameterPresent | isNotParameterPresent | isEmpty | isNotEmpty | isNotNull | isNull | isNotEqual | isEqual | isGreaterThan | isGreaterEqual | isLessThan | isLessEqual | isPropertyAvailable | isNotPropertyAvailable)*>
<!ATTLIST isNull
prepend CDATA #IMPLIED
property CDATA #IMPLIED
>

<!ELEMENT isNotPropertyAvailable (#PCDATA | iterate | isParameterPresent | isNotParameterPresent | isEmpty | isNotEmpty | isNotNull | isNull | isNotEqual | isEqual | isGreaterThan | isGreaterEqual | isLessThan | isLessEqual | isPropertyAvailable | isNotPropertyAvailable)*>
<!ATTLIST isNotPropertyAvailable
prepend CDATA #IMPLIED
property CDATA #REQUIRED
>

<!ELEMENT isPropertyAvailable (#PCDATA | iterate | isParameterPresent | isNotParameterPresent | isEmpty | isNotEmpty | isNotNull | isNull | isNotEqual | isEqual | isGreaterThan | isGreaterEqual | isLessThan | isLessEqual | isPropertyAvailable | isNotPropertyAvailable)*>
<!ATTLIST isPropertyAvailable
prepend CDATA #IMPLIED
property CDATA #REQUIRED
>

<!ELEMENT isEqual (#PCDATA | iterate | isParameterPresent | isNotParameterPresent | isEmpty | isNotEmpty | isNotNull | isNull | isNotEqual | isEqual | isGreaterThan | isGreaterEqual | isLessThan | isLessEqual | isPropertyAvailable | isNotPropertyAvailable)*>
<!ATTLIST isEqual
prepend CDATA #IMPLIED
property CDATA #IMPLIED
compareProperty CDATA #IMPLIED
compareValue CDATA #IMPLIED
>

<!ELEMENT isNotEqual (#PCDATA | iterate | isParameterPresent | isNotParameterPresent | isEmpty | isNotEmpty | isNotNull | isNull | isNotEqual | isEqual | isGreaterThan | isGreaterEqual | isLessThan | isLessEqual | isPropertyAvailable | isNotPropertyAvailable)*>
<!ATTLIST isNotEqual
prepend CDATA #IMPLIED
property CDATA #IMPLIED
compareProperty CDATA #IMPLIED
compareValue CDATA #IMPLIED
>

<!ELEMENT isGreaterThan (#PCDATA | iterate | isParameterPresent | isNotParameterPresent | isEmpty | isNotEmpty | isNotNull | isNull | isNotEqual | isEqual | isGreaterThan | isGreaterEqual | isLessThan | isLessEqual | isPropertyAvailable | isNotPropertyAvailable)*>
<!ATTLIST isGreaterThan
prepend CDATA #IMPLIED
property CDATA #IMPLIED
compareProperty CDATA #IMPLIED
compareValue CDATA #IMPLIED
>

<!ELEMENT isGreaterEqual (#PCDATA | iterate | isParameterPresent | isNotParameterPresent | isEmpty | isNotEmpty | isNotNull | isNull | isNotEqual | isEqual | isGreaterThan | isGreaterEqual | isLessThan | isLessEqual | isPropertyAvailable | isNotPropertyAvailable)*>
<!ATTLIST isGreaterEqual
prepend CDATA #IMPLIED
property CDATA #IMPLIED
compareProperty CDATA #IMPLIED
compareValue CDATA #IMPLIED
>

<!ELEMENT isLessThan (#PCDATA | iterate | isParameterPresent | isNotParameterPresent | isEmpty | isNotEmpty | isNotNull | isNull | isNotEqual | isEqual | isGreaterThan | isGreaterEqual | isLessThan | isLessEqual | isPropertyAvailable | isNotPropertyAvailable)*>
<!ATTLIST isLessThan
prepend CDATA #IMPLIED
property CDATA #IMPLIED
compareProperty CDATA #IMPLIED
compareValue CDATA #IMPLIED
>

<!ELEMENT isLessEqual (#PCDATA | iterate | isParameterPresent | isNotParameterPresent | isEmpty | isNotEmpty | isNotNull | isNull | isNotEqual | isEqual | isGreaterThan | isGreaterEqual | isLessThan | isLessEqual | isPropertyAvailable | isNotPropertyAvailable)*>
<!ATTLIST isLessEqual
prepend CDATA #IMPLIED
property CDATA #IMPLIED
compareProperty CDATA #IMPLIED
compareValue CDATA #IMPLIED
>

<!ELEMENT isEmpty (#PCDATA | iterate | isParameterPresent | isNotParameterPresent | isEmpty | isNotEmpty | isNotNull | isNull | isNotEqual | isEqual | isGreaterThan | isGreaterEqual | isLessThan | isLessEqual | isPropertyAvailable | isNotPropertyAvailable)*>
<!ATTLIST isEmpty
prepend CDATA #IMPLIED
property CDATA #IMPLIED
>

<!ELEMENT isNotEmpty (#PCDATA | iterate | isParameterPresent | isNotParameterPresent | isEmpty | isNotEmpty | isNotNull | isNull | isNotEqual | isEqual | isGreaterThan | isGreaterEqual | isLessThan | isLessEqual | isPropertyAvailable | isNotPropertyAvailable)*>
<!ATTLIST isNotEmpty
prepend CDATA #IMPLIED
property CDATA #IMPLIED
>

<!ELEMENT isParameterPresent (#PCDATA | iterate | isParameterPresent | isNotParameterPresent | isEmpty | isNotEmpty | isNotNull | isNull | isNotEqual | isEqual | isGreaterThan | isGreaterEqual | isLessThan | isLessEqual | isPropertyAvailable | isNotPropertyAvailable)*>
<!ATTLIST isParameterPresent
prepend CDATA #IMPLIED
>

<!ELEMENT isNotParameterPresent (#PCDATA | iterate | isParameterPresent | isNotParameterPresent | isEmpty | isNotEmpty | isNotNull | isNull | isNotEqual | isEqual | isGreaterThan | isGreaterEqual | isLessThan | isLessEqual | isPropertyAvailable | isNotPropertyAvailable)*>
<!ATTLIST isNotParameterPresent
prepend CDATA #IMPLIED
>

<!ELEMENT iterate (#PCDATA | iterate | isParameterPresent | isNotParameterPresent | isEmpty | isNotEmpty | isNotNull | isNull | isNotEqual | isEqual | isGreaterThan | isGreaterEqual | isLessThan | isLessEqual | isPropertyAvailable | isNotPropertyAvailable)*>
<!ATTLIST iterate
prepend CDATA #IMPLIED
property CDATA #IMPLIED
open CDATA #IMPLIED
close CDATA #IMPLIED
conjunction CDATA #IMPLIED
>
