<?xml version="1.0" encoding="UTF-8" ?>

<!DOCTYPE sqlMap      
    PUBLIC "-//ibatis.apache.org//DTD SQL Map 2.0//EN"      
    "http://ibatis.apache.org/dtd/sql-map-2.dtd">

<sqlMap namespace="DerbyProc">

  <typeAlias alias="account" type="testdomain.Account"/>

  <parameterMap id="multiList" class="map" >
    <parameter property="accountId1" jdbcType="INTEGER" javaType="java.lang.Integer" mode="IN"/>
    <parameter property="accountId2" jdbcType="INTEGER" javaType="java.lang.Integer" mode="IN"/>
    <parameter property="accountId3" jdbcType="INTEGER" javaType="java.lang.Integer" mode="IN"/>
    <parameter property="accountId4" jdbcType="INTEGER" javaType="java.lang.Integer" mode="IN"/>
  </parameterMap>
  
  <resultMap id="account-result" class="account">
    <result property="id" column="ACC_ID" columnIndex="1"/>
    <result property="firstName" column="ACC_FIRST_NAME" columnIndex="2"/>
    <result property="lastName" column="ACC_LAST_NAME" columnIndex="3"/>
    <result property="emailAddress" column="ACC_EMAIL" columnIndex="4" nullValue="no_email@provided.com"/>
  </resultMap>
  <!-- <parameter property="accountList" javaType="list" mode="OUT"/> -->
  <!-- <parameter property="accountList" javaType="list" mode="OUT"/> -->
  
  <procedure id="getMultiListsRm" parameterMap="multiList" resultMap="account-result">
     {call MRESULTSET(?,?,?,?)}
  </procedure>
  
  <procedure id="getMultiListsRc" parameterMap="multiList" resultClass="account">
     {call MRESULTSET(?,?,?,?)}
  </procedure>
</sqlMap>